{
  "metadata": {
    "name": "ICEP",
    "version": "1.0.0",
    "description": "Sistema de Gestão Educacional ICEP",
    "author": "Gerador MetaModel",
    "createdAt": "2025-12-13T00:00:00Z",
    "updatedAt": "2025-12-13T00:00:00Z",
    "database": {
      "type": "SQLSERVER",
      "schema": "dbo"
    },
    "sessionContext": [
      {
        "entity": "Avaliacao",
        "field": "avaliacaoId",
        "displayField": "avaliacao",
        "label": "Selecione a Avaliação",
        "required": true,
        "inputType": "radio"
      },
      {
        "entity": "Municipio",
        "field": "municipioId",
        "displayField": "nome",
        "label": "Selecione o Município",
        "required": true,
        "inputType": "radio"
      }
    ],
    "accessControl": {
      "roles": [
        {
          "id": "admin",
          "name": "Administrador",
          "description": "Acesso total ao sistema",
          "permissions": [
            {
              "module": "*",
              "access": "full"
            }
          ]
        },
        {
          "id": "municipio",
          "name": "Município",
          "description": "Acesso ao módulo de avaliação",
          "permissions": [
            {
              "module": "avaliacao",
              "access": "full"
            }
          ]
        },
        {
          "id": "territorio",
          "name": "Território",
          "description": "Acesso somente leitura ao módulo de avaliação",
          "permissions": [
            {
              "module": "avaliacao",
              "access": "readonly"
            }
          ]
        }
      ]
    }
  },
  "modules": [
    {
      "id": "cadastro",
      "name": "Cadastro",
      "description": "Cadastros básicos do sistema",
      "icon": "folder",
      "order": 1,
      "items": [
        { "id": "menu_avaliacao_periodo", "name": "Avaliações", "entityRef": "Avaliacao", "icon": "event_note", "order": 1 },
        { "id": "menu_territorio", "name": "Territórios", "entityRef": "Territorio", "icon": "public", "order": 2 },
        { "id": "menu_municipio", "name": "Municípios", "entityRef": "Municipio", "icon": "location_city", "order": 3 },
        { "id": "menu_publico_alvo", "name": "Público Alvo", "entityRef": "PublicoAlvo", "icon": "groups", "order": 4 },
        { "id": "menu_segmento_atendido", "name": "Segmentos Atendidos", "entityRef": "SegmentoAtendido", "icon": "category", "order": 5 },
        { "id": "menu_formacao", "name": "Tipos de Formação", "entityRef": "Formacao", "icon": "list_alt", "order": 6 },
        { "id": "menu_formacao_territorio", "name": "Tipos de Formação Território", "entityRef": "FormacaoTerritorio", "icon": "list", "order": 7 },
        { "id": "menu_ano_escolar", "name": "Anos Escolares", "entityRef": "AnoEscolar", "icon": "event", "order": 8 },
        { "id": "menu_componente_curricular", "name": "Componentes Curriculares", "entityRef": "ComponenteCurricular", "icon": "auto_stories", "order": 9 },
        { "id": "menu_conceito_aprendido", "name": "Conceitos Aprendidos", "entityRef": "ConceitoAprendido", "icon": "lightbulb", "order": 10 },
        { "id": "menu_aprendizagem_esperada", "name": "Aprendizagens Esperadas", "entityRef": "AprendizagemEsperada", "icon": "school", "order": 11 },
        { "id": "menu_ambito_gestao", "name": "Âmbitos de Gestão", "entityRef": "AmbitoGestao", "icon": "account_tree", "order": 12 },
        { "id": "menu_indicador", "name": "Indicadores", "entityRef": "Indicador", "icon": "speed", "order": 13 }
      ]
    },
    {
      "id": "avaliacao",
      "name": "Avaliação",
      "description": "Avaliações e resultados",
      "icon": "grading",
      "order": 2,
      "items": [
        { "id": "menu_avaliacao_sda", "name": "SDA", "entityRef": "AvaliacaoSDA", "icon": "fact_check", "order": 1 },
        { "id": "menu_avaliacao_indicador", "name": "Indicadores", "entityRef": "AvaliacaoIndicador", "icon": "assessment", "order": 2 },
        { "id": "menu_comentario_indicador", "name": "Comentários", "entityRef": "ComentarioIndicador", "icon": "chat", "order": 3 },
        { "id": "menu_atendimento_municipio", "name": "Atendimento por Município", "entityRef": "AtendimentoMunicipio", "icon": "people", "order": 4 },
        { "id": "menu_carga_horaria", "name": "Carga Horária Formação", "entityRef": "CargaHorariaFormacao", "icon": "schedule", "order": 5 },
        { "id": "menu_carga_horaria_territorio", "name": "Carga Horária por Território", "entityRef": "CargaHorariaFormacaoTerritorio", "icon": "schedule", "order": 6 }
      ]
    }
  ],
  "enums": [
    {
      "id": "enum_etapa",
      "name": "Etapa",
      "description": "Etapas de ensino escolar",
      "values": [
        { "code": "educacao_infantil", "label": "Educação Infantil" },
        { "code": "anos_iniciais", "label": "Anos Iniciais" },
        { "code": "anos_finais", "label": "Anos Finais" }
      ]
    },
    {
      "id": "enum_tipo_publico",
      "name": "TipoPublico",
      "description": "Tipos de público alvo",
      "values": [
        { "code": "Publico Direto", "label": "Público Direto" },
        { "code": "Publico Indireto", "label": "Público Indireto" }
      ]
    },
    {
      "id": "enum_nivel_aprendizagem",
      "name": "NivelAprendizagem",
      "description": "Níveis de aprendizagem",
      "values": [
        { "code": "1", "label": "Nível 1 - Básico" },
        { "code": "2", "label": "Nível 2 - Intermediário" },
        { "code": "3", "label": "Nível 3 - Avançado" }
      ]
    }
  ],
  "entities": [
    {
      "id": "avaliacao",
      "name": "Avaliacao",
      "displayName": "Avaliações",
      "tableName": "Avaliacao",
      "description": "Períodos de avaliação",
      "schema": "dbo",
      "type": "LOOKUP",
      "defaultSort": { "field": "avaliacao", "direction": "desc" },
      "fields": [
        {
          "id": "avaliacao_id",
          "name": "id",
          "columnName": "id",
          "label": "Codigo",
          "dataType": "INTEGER",
          "databaseType": "int",
          "primaryKey": true,
          "autoIncrement": true,
          "required": true,
          "ui": {
            "component": "NUMBER",
            "grid": { "visible": true, "order": 1, "width": 80 },
            "form": { "visible": true, "order": 1 }
          }
        },
        {
          "id": "avaliacao_avaliacao",
          "name": "avaliacao",
          "columnName": "avaliacao",
          "label": "Avaliação",
          "dataType": "STRING",
          "databaseType": "char",
          "length": 6,
          "required": true,
          "ui": {
            "component": "TEXT",
            "grid": { "visible": true, "order": 2, "sortable": true },
            "form": { "visible": true, "order": 2 },
            "search": { "enabled": true, "operator": "EQUALS" }
          }
        }
      ]
    },
    {
      "id": "territorio",
      "name": "Territorio",
      "displayName": "Territórios",
      "tableName": "Territorio",
      "description": "Cadastro de territórios",
      "schema": "dbo",
      "type": "LOOKUP",
      "defaultSort": { "field": "nome", "direction": "asc" },
      "fields": [
        {
          "id": "territorio_id",
          "name": "id",
          "columnName": "id",
          "label": "Codigo",
          "dataType": "INTEGER",
          "databaseType": "int",
          "primaryKey": true,
          "autoIncrement": true,
          "required": true,
          "ui": {
            "component": "NUMBER",
            "grid": { "visible": true, "order": 1, "width": 80 },
            "form": { "visible": true, "order": 1 },
            "search": { "enabled": true, "operator": "EQUALS" }
          }
        },
        {
          "id": "territorio_nome",
          "name": "nome",
          "columnName": "nome",
          "label": "Nome",
          "dataType": "STRING",
          "databaseType": "nvarchar",
          "length": 100,
          "required": true,
          "ui": {
            "component": "TEXT",
            "grid": { "visible": true, "order": 2, "sortable": true },
            "form": { "visible": true, "order": 2 },
            "search": { "enabled": true, "operator": "CONTAINS" }
          }
        },
        {
          "id": "territorio_descricao",
          "name": "descricao",
          "columnName": "descricao",
          "label": "Descrição",
          "dataType": "STRING",
          "databaseType": "nvarchar",
          "length": 255,
          "required": false,
          "ui": {
            "component": "TEXTAREA",
            "grid": { "visible": true, "order": 3, "sortable": true },
            "form": { "visible": true, "order": 3 }
          }
        }
      ]
    },
    {
      "id": "municipio",
      "name": "Municipio",
      "displayName": "Municípios",
      "tableName": "Municipio",
      "description": "Cadastro de municípios atendidos",
      "schema": "dbo",
      "type": "MAIN",
      "defaultSort": { "field": "nome", "direction": "asc" },
      "fields": [
        {
          "id": "municipio_id",
          "name": "id",
          "columnName": "id",
          "label": "Codigo",
          "dataType": "INTEGER",
          "databaseType": "int",
          "primaryKey": true,
          "autoIncrement": true,
          "required": true,
          "ui": {
            "component": "NUMBER",
            "grid": { "visible": true, "order": 1, "width": 80 },
            "form": { "visible": true, "order": 1 }
          }
        },
        {
          "id": "municipio_territorio_id",
          "name": "territorioId",
          "columnName": "territorio_id",
          "label": "Território",
          "dataType": "INTEGER",
          "databaseType": "int",
          "required": true,
          "reference": {
            "entity": "Territorio",
            "field": "id"
          },
          "ui": {
            "component": "AUTOCOMPLETE",